<?xml version="1.0"?>
<!DOCTYPE HPCToolkitExperiment [
<!-- ******************************************************************** -->
<!-- HPCToolkit Experiment DTD						  -->
<!-- Version 2.0							  -->
<!-- ******************************************************************** -->
<!ELEMENT HPCToolkitExperiment (Header, (SecCallPathProfile|SecFlatProfile)*)>
<!ATTLIST HPCToolkitExperiment
	  version CDATA #REQUIRED>

  <!-- ****************************************************************** -->

  <!-- Info/NV: flexible name-value pairs: (n)ame; (t)ype; (v)alue -->
  <!ELEMENT Info (NV*)>
  <!ATTLIST Info
	    n CDATA #IMPLIED>
  <!ELEMENT NV EMPTY>
  <!ATTLIST NV
	    n CDATA #REQUIRED
	    t CDATA #IMPLIED
	    v CDATA #REQUIRED>

  <!-- ****************************************************************** -->
  <!-- Header								  -->
  <!-- ****************************************************************** -->
  <!ELEMENT Header (Info*)>
  <!ATTLIST Header
	    n CDATA #REQUIRED>

  <!-- ****************************************************************** -->
  <!-- Section Header							  -->
  <!-- ****************************************************************** -->
  <!ELEMENT SecHeader (MetricTable?, MetricDBTable?, TraceDBTable?, LoadModuleTable?, FileTable?, ProcedureTable?, Info*)>

    <!-- MetricTable: -->
    <!ELEMENT MetricTable (Metric)*>

    <!-- Metric: (i)d; (n)ame -->
    <!--   (v)alue-type: transient type of values -->
    <!--   (t)ype: persistent type of metric -->
    <!--   fmt: format; show; -->
    <!ELEMENT Metric (MetricFormula*, Info?)>
    <!ATTLIST Metric
	      i            CDATA #REQUIRED
	      n            CDATA #REQUIRED
	      v            (raw|final|derived-incr|derived) "raw"
	      t            (inclusive|exclusive|nil) "nil"
	      partner      CDATA #IMPLIED
	      fmt          CDATA #IMPLIED
	      show         (1|0) "1"
	      show-percent (1|0) "1">

    <!-- MetricFormula represents derived metrics: (t)ype; (frm): formula -->
    <!ELEMENT MetricFormula (Info?)>
    <!ATTLIST MetricFormula
	      t   (combine|finalize) "finalize"
	      i   CDATA #IMPLIED
	      frm CDATA #REQUIRED>

    <!-- Metric data, used in sections: (n)ame [from Metric]; (v)alue -->
    <!ELEMENT M EMPTY>
    <!ATTLIST M
	      n CDATA #REQUIRED
	      v CDATA #REQUIRED>

    <!-- MetricDBTable: -->
    <!ELEMENT MetricDBTable (MetricDB)*>

    <!-- MetricDB: (i)d; (n)ame -->
    <!--   db-glob:        file glob describing files in metric db -->
    <!--   db-id:          id within metric db -->
    <!--   db-num-metrics: number of metrics in db -->
    <!--   db-header-sz:   size (in bytes) of a db file header -->
    <!ELEMENT MetricDB EMPTY>
    <!ATTLIST MetricDB
	      i              CDATA #REQUIRED
	      n              CDATA #REQUIRED
	      db-glob        CDATA #IMPLIED
	      db-id          CDATA #IMPLIED
	      db-num-metrics CDATA #IMPLIED
	      db-header-sz   CDATA #IMPLIED>

    <!-- TraceDBTable: -->
    <!ELEMENT TraceDBTable (TraceDB)>

    <!-- TraceDB: (i)d -->
    <!--   db-min-time: min beginning time stamp (global) -->
    <!--   db-max-time: max ending time stamp (global) -->
    <!ELEMENT TraceDB EMPTY>
    <!ATTLIST TraceDB
	      i            CDATA #REQUIRED
	      db-glob      CDATA #IMPLIED
	      db-min-time  CDATA #IMPLIED
	      db-max-time  CDATA #IMPLIED
	      db-header-sz CDATA #IMPLIED>

    <!-- LoadModuleTable assigns a short name to a load module -->
    <!ELEMENT LoadModuleTable (LoadModule)*>

    <!ELEMENT LoadModule (Info?)>
    <!ATTLIST LoadModule
	      i CDATA #REQUIRED
	      n CDATA #REQUIRED>

    <!-- FileTable assigns a short name to a file -->
    <!ELEMENT FileTable (File)*>

    <!ELEMENT File (Info?)>
    <!ATTLIST File
	      i CDATA #REQUIRED
	      n CDATA #REQUIRED>

    <!-- ProcedureTable assigns a short name to a procedure -->
    <!ELEMENT ProcedureTable (Procedure)*>

    <!ELEMENT Procedure (Info?)>
    <!ATTLIST Procedure
	      i CDATA #REQUIRED
	      n CDATA #REQUIRED>

  <!-- ****************************************************************** -->
  <!-- Section: Call path profile					  -->
  <!-- ****************************************************************** -->
  <!ELEMENT SecCallPathProfile (SecHeader, SecCallPathProfileData)>
  <!ATTLIST SecCallPathProfile
	    i CDATA #REQUIRED
	    n CDATA #REQUIRED>

    <!ELEMENT SecCallPathProfileData (PF|M)*>
      <!-- Procedure frame -->
      <!--   (i)d: unique identifier for cross referencing -->
      <!--   (s)tatic scope id -->
      <!--   (n)ame: a string or an id in ProcedureTable -->
      <!--   (lm) load module: a string or an id in LoadModuleTable -->
      <!--   (f)ile name: a string or an id in LoadModuleTable -->
      <!--   (l)ine range: "beg-end" (inclusive range) -->
      <!--   (a)lien: whether frame is alien to enclosing P -->
      <!--   (v)ma-range-set: "{[beg-end), [beg-end)...}" -->
      <!ELEMENT PF (PF|Pr|L|C|S|M)*>
      <!ATTLIST PF
		i  CDATA #IMPLIED
		s  CDATA #IMPLIED
		n  CDATA #REQUIRED
		lm CDATA #IMPLIED
		f  CDATA #IMPLIED
		l  CDATA #IMPLIED
		v  CDATA #IMPLIED>
      <!-- Procedure (static): GOAL: replace with 'P' -->
      <!ELEMENT Pr (Pr|L|C|S|M)*>
      <!ATTLIST Pr
                i  CDATA #IMPLIED
		s  CDATA #IMPLIED
                n  CDATA #REQUIRED
		lm CDATA #IMPLIED
		f  CDATA #IMPLIED
                l  CDATA #IMPLIED
		a  (1|0) "0"
		v  CDATA #IMPLIED>
      <!-- Callsite (a special StatementRange) -->
      <!ELEMENT C (PF|M)*>
      <!ATTLIST C
		i CDATA #IMPLIED
		s CDATA #IMPLIED
		l CDATA #IMPLIED
		v CDATA #IMPLIED>

  <!-- ****************************************************************** -->
  <!-- Section: Flat profile						  -->
  <!-- ****************************************************************** -->
  <!ELEMENT SecFlatProfile (SecHeader, SecFlatProfileData)>
  <!ATTLIST SecFlatProfile
	    i CDATA #REQUIRED
	    n CDATA #REQUIRED>

    <!ELEMENT SecFlatProfileData (LM|M)*>
      <!-- Load module: (i)d; (n)ame; (v)ma-range-set -->
      <!ELEMENT LM (F|P|M)*>
      <!ATTLIST LM
                i CDATA #IMPLIED
                n CDATA #REQUIRED
		v CDATA #IMPLIED>
      <!-- File -->
      <!ELEMENT F (P|L|S|M)*>
      <!ATTLIST F
                i CDATA #IMPLIED
                n CDATA #REQUIRED>
      <!-- Procedure (Note 1) -->
      <!ELEMENT P (P|A|L|S|C|M)*>
      <!ATTLIST P
                i CDATA #IMPLIED
                n CDATA #REQUIRED
                l CDATA #IMPLIED
		v CDATA #IMPLIED>
      <!-- Alien (Note 1) -->
      <!ELEMENT A (A|L|S|C|M)*>
      <!ATTLIST A
                i CDATA #IMPLIED
                f CDATA #IMPLIED
                n CDATA #IMPLIED
                l CDATA #IMPLIED
		v CDATA #IMPLIED>
      <!-- Loop (Note 1,2) -->
      <!ELEMENT L (A|Pr|L|S|C|M)*>
      <!ATTLIST L
		i CDATA #IMPLIED
		s CDATA #IMPLIED
		l CDATA #IMPLIED
		v CDATA #IMPLIED>
      <!-- Statement (Note 2) -->
      <!--   (it): trace record identifier -->
      <!ELEMENT S (S|M)*>
      <!ATTLIST S
		i  CDATA #IMPLIED
		it CDATA #IMPLIED
		s  CDATA #IMPLIED
		l  CDATA #IMPLIED
		v  CDATA #IMPLIED>
      <!-- Note 1: Contained Cs may not contain PFs -->
      <!-- Note 2: The 's' attribute is not used for flat profiles -->
]>
<HPCToolkitExperiment version="2.0">
<Header n="path-omp.x">
  <Info/>
</Header>
<SecCallPathProfile i="0" n="path-omp.x">
<SecHeader>
  <MetricTable>
    <Metric i="16" n="WALLCLOCK (us):Sum (I)" v="derived-incr" t="inclusive" partner="27" show="1" show-percent="1">
      <MetricFormula t="combine" frm="sum($16, $16)"/>
      <MetricFormula t="finalize" frm="$16"/>
      <Info><NV n="units" v="events"/></Info>
    </Metric>
    <Metric i="17" n="WALLCLOCK (us):Mean (I)" v="derived-incr" t="inclusive" partner="28" show="1" show-percent="0">
      <MetricFormula t="combine" frm="sum($17, $17)"/>
      <MetricFormula t="finalize" frm="$17 / $18"/>
      <Info><NV n="units" v="events"/></Info>
    </Metric>
    <Metric i="18" n="WALLCLOCK (us):Mean:num-src (I)" v="derived-incr" t="inclusive" partner="29" show="0" show-percent="0">
      <MetricFormula t="combine" frm="sum($18, $18)"/>
      <MetricFormula t="finalize" frm="$18"/>
      <Info><NV n="units" v="events"/></Info>
    </Metric>
    <Metric i="19" n="WALLCLOCK (us):StdDev (I)" v="derived-incr" t="inclusive" partner="30" show="1" show-percent="0">
      <MetricFormula t="combine" frm="sum($19, $19)"/>
      <MetricFormula t="finalize" frm="sqrt(($20 / $21) - pow($19 / $21, 2))"/>
      <Info><NV n="units" v="events"/></Info>
    </Metric>
    <Metric i="20" n="WALLCLOCK (us):StdDev:accum2 (I)" v="derived-incr" t="inclusive" partner="31" show="0" show-percent="0">
      <MetricFormula t="combine" frm="sum($20, $20)"/>
      <Info><NV n="units" v="events"/></Info>
    </Metric>
    <Metric i="21" n="WALLCLOCK (us):StdDev:num-src (I)" v="derived-incr" t="inclusive" partner="32" show="0" show-percent="0">
      <MetricFormula t="combine" frm="sum($21, $21)"/>
      <MetricFormula t="finalize" frm="$21"/>
      <Info><NV n="units" v="events"/></Info>
    </Metric>
    <Metric i="22" n="WALLCLOCK (us):CfVar (I)" v="derived-incr" t="inclusive" partner="33" show="1" show-percent="0">
      <MetricFormula t="combine" frm="sum($22, $22)"/>
      <MetricFormula t="finalize" frm="sqrt(($23 / $24) - pow($22 / $24, 2)) / ($22 / $24)"/>
      <Info><NV n="units" v="events"/></Info>
    </Metric>
    <Metric i="23" n="WALLCLOCK (us):CfVar:accum2 (I)" v="derived-incr" t="inclusive" partner="34" show="0" show-percent="0">
      <MetricFormula t="combine" frm="sum($23, $23)"/>
      <Info><NV n="units" v="events"/></Info>
    </Metric>
    <Metric i="24" n="WALLCLOCK (us):CfVar:num-src (I)" v="derived-incr" t="inclusive" partner="35" show="0" show-percent="0">
      <MetricFormula t="combine" frm="sum($24, $24)"/>
      <MetricFormula t="finalize" frm="$24"/>
      <Info><NV n="units" v="events"/></Info>
    </Metric>
    <Metric i="25" n="WALLCLOCK (us):Min (I)" v="derived-incr" t="inclusive" partner="36" show="1" show-percent="0">
      <MetricFormula t="combine" frm="min($25, $25)"/>
      <MetricFormula t="finalize" frm="$25"/>
      <Info><NV n="units" v="events"/></Info>
    </Metric>
    <Metric i="26" n="WALLCLOCK (us):Max (I)" v="derived-incr" t="inclusive" partner="37" show="1" show-percent="0">
      <MetricFormula t="combine" frm="max($26, $26)"/>
      <MetricFormula t="finalize" frm="$26"/>
      <Info><NV n="units" v="events"/></Info>
    </Metric>
    <Metric i="27" n="WALLCLOCK (us):Sum (E)" v="derived-incr" t="exclusive" partner="16" show="1" show-percent="1">
      <MetricFormula t="combine" frm="sum($27, $27)"/>
      <MetricFormula t="finalize" frm="$27"/>
      <Info><NV n="units" v="events"/></Info>
    </Metric>
    <Metric i="28" n="WALLCLOCK (us):Mean (E)" v="derived-incr" t="exclusive" partner="17" show="1" show-percent="0">
      <MetricFormula t="combine" frm="sum($28, $28)"/>
      <MetricFormula t="finalize" frm="$28 / $29"/>
      <Info><NV n="units" v="events"/></Info>
    </Metric>
    <Metric i="29" n="WALLCLOCK (us):Mean:num-src (E)" v="derived-incr" t="exclusive" partner="18" show="0" show-percent="0">
      <MetricFormula t="combine" frm="sum($29, $29)"/>
      <MetricFormula t="finalize" frm="$29"/>
      <Info><NV n="units" v="events"/></Info>
    </Metric>
    <Metric i="30" n="WALLCLOCK (us):StdDev (E)" v="derived-incr" t="exclusive" partner="19" show="1" show-percent="0">
      <MetricFormula t="combine" frm="sum($30, $30)"/>
      <MetricFormula t="finalize" frm="sqrt(($31 / $32) - pow($30 / $32, 2))"/>
      <Info><NV n="units" v="events"/></Info>
    </Metric>
    <Metric i="31" n="WALLCLOCK (us):StdDev:accum2 (E)" v="derived-incr" t="exclusive" partner="20" show="0" show-percent="0">
      <MetricFormula t="combine" frm="sum($31, $31)"/>
      <Info><NV n="units" v="events"/></Info>
    </Metric>
    <Metric i="32" n="WALLCLOCK (us):StdDev:num-src (E)" v="derived-incr" t="exclusive" partner="21" show="0" show-percent="0">
      <MetricFormula t="combine" frm="sum($32, $32)"/>
      <MetricFormula t="finalize" frm="$32"/>
      <Info><NV n="units" v="events"/></Info>
    </Metric>
    <Metric i="33" n="WALLCLOCK (us):CfVar (E)" v="derived-incr" t="exclusive" partner="22" show="1" show-percent="0">
      <MetricFormula t="combine" frm="sum($33, $33)"/>
      <MetricFormula t="finalize" frm="sqrt(($34 / $35) - pow($33 / $35, 2)) / ($33 / $35)"/>
      <Info><NV n="units" v="events"/></Info>
    </Metric>
    <Metric i="34" n="WALLCLOCK (us):CfVar:accum2 (E)" v="derived-incr" t="exclusive" partner="23" show="0" show-percent="0">
      <MetricFormula t="combine" frm="sum($34, $34)"/>
      <Info><NV n="units" v="events"/></Info>
    </Metric>
    <Metric i="35" n="WALLCLOCK (us):CfVar:num-src (E)" v="derived-incr" t="exclusive" partner="24" show="0" show-percent="0">
      <MetricFormula t="combine" frm="sum($35, $35)"/>
      <MetricFormula t="finalize" frm="$35"/>
      <Info><NV n="units" v="events"/></Info>
    </Metric>
    <Metric i="36" n="WALLCLOCK (us):Min (E)" v="derived-incr" t="exclusive" partner="25" show="1" show-percent="0">
      <MetricFormula t="combine" frm="min($36, $36)"/>
      <MetricFormula t="finalize" frm="$36"/>
      <Info><NV n="units" v="events"/></Info>
    </Metric>
    <Metric i="37" n="WALLCLOCK (us):Max (E)" v="derived-incr" t="exclusive" partner="26" show="1" show-percent="0">
      <MetricFormula t="combine" frm="max($37, $37)"/>
      <MetricFormula t="finalize" frm="$37"/>
      <Info><NV n="units" v="events"/></Info>
    </Metric>
  </MetricTable>
  <MetricDBTable>
  </MetricDBTable>
  <LoadModuleTable>
    <LoadModule i="2" n="/home/dsj36/CS-5220-Projects/path/path-omp.x"/>
    <LoadModule i="237" n="/share/apps/local/hpctoolkit/lib/hpctoolkit/ext-libs/libmonitor.so.0.0.0"/>
    <LoadModule i="241" n="/usr/lib64/libgomp.so.1.0.0"/>
  </LoadModuleTable>
  <FileTable>
    <File i="3" n="./src/home/dsj36/CS-5220-Projects/path/mt19937p.c"/>
    <File i="36" n="./src/home/dsj36/CS-5220-Projects/path/path-omp.c"/>
    <File i="238" n="./src/share/apps/src/update/hpc/hpctoolkit-externals-5.1.0-r3542/BUILD/libmonitor/libmonitor-0.x-r116/src/pthread.c"/>
    <File i="242" n="~unknown-file~"/>
  </FileTable>
  <ProcedureTable>
    <Procedure i="14" n="genrand"/>
    <Procedure i="37" n="square.omp_fn.0"/>
    <Procedure i="55" n="square"/>
    <Procedure i="64" n="infinitize"/>
    <Procedure i="78" n="shortest_paths"/>
    <Procedure i="99" n="gen_graph"/>
    <Procedure i="114" n="fletcher16"/>
    <Procedure i="144" n="main"/>
    <Procedure i="239" n="pthread_create"/>
    <Procedure i="243" n="~unknown-proc~"/>
  </ProcedureTable>
  <Info/>
</SecHeader>
<SecCallPathProfileData>
<M n="16" v="8.67763e+07"/><M n="17" v="8.67763e+07"/><M n="18" v="8"/><M n="19" v="8.67763e+07"/><M n="20" v="9.41273e+14"/><M n="21" v="8"/><M n="22" v="8.67763e+07"/><M n="23" v="9.41273e+14"/><M n="24" v="8"/><M n="25" v="1.0822e+07"/><M n="26" v="1.09253e+07"/><M n="29" v="8"/><M n="32" v="8"/><M n="35" v="8"/><M n="36" v="2.22507e-308"/>
<PF i="2" s="144" l="200" lm="2" f="36" n="144">
<M n="16" v="8.67763e+07"/><M n="17" v="8.67763e+07"/><M n="18" v="8"/><M n="19" v="8.67763e+07"/><M n="20" v="9.41273e+14"/><M n="21" v="8"/><M n="22" v="8.67763e+07"/><M n="23" v="9.41273e+14"/><M n="24" v="8"/><M n="25" v="1.0822e+07"/><M n="26" v="1.09253e+07"/><M n="29" v="8"/><M n="32" v="8"/><M n="35" v="8"/><M n="36" v="2.22507e-308"/>
<C i="3" s="166" l="224">
<M n="16" v="55074"/><M n="17" v="55074"/><M n="18" v="8"/><M n="19" v="55074"/><M n="20" v="3.03315e+09"/><M n="21" v="8"/><M n="22" v="55074"/><M n="23" v="3.03315e+09"/><M n="24" v="8"/><M n="25" v="55074"/><M n="26" v="55074"/><M n="29" v="8"/><M n="32" v="8"/><M n="35" v="8"/><M n="36" v="2.22507e-308"/>
<PF i="4" s="99" l="132" lm="2" f="36" n="99">
<M n="16" v="55074"/><M n="17" v="55074"/><M n="18" v="8"/><M n="19" v="55074"/><M n="20" v="3.03315e+09"/><M n="21" v="8"/><M n="22" v="55074"/><M n="23" v="3.03315e+09"/><M n="24" v="8"/><M n="25" v="55074"/><M n="26" v="55074"/><M n="27" v="27516"/><M n="28" v="27516"/><M n="29" v="8"/><M n="30" v="27516"/><M n="31" v="7.5713e+08"/><M n="32" v="8"/><M n="33" v="27516"/><M n="34" v="7.5713e+08"/><M n="35" v="8"/><M n="36" v="27516"/><M n="37" v="27516"/>
<L i="5" s="105" l="136">
<M n="16" v="55074"/><M n="17" v="55074"/><M n="18" v="8"/><M n="19" v="55074"/><M n="20" v="3.03315e+09"/><M n="21" v="8"/><M n="22" v="55074"/><M n="23" v="3.03315e+09"/><M n="24" v="8"/><M n="25" v="55074"/><M n="26" v="55074"/><M n="29" v="8"/><M n="32" v="8"/><M n="35" v="8"/><M n="36" v="2.22507e-308"/>
<L i="6" s="107" l="137">
<M n="16" v="55074"/><M n="17" v="55074"/><M n="18" v="8"/><M n="19" v="55074"/><M n="20" v="3.03315e+09"/><M n="21" v="8"/><M n="22" v="55074"/><M n="23" v="3.03315e+09"/><M n="24" v="8"/><M n="25" v="55074"/><M n="26" v="55074"/><M n="27" v="27516"/><M n="28" v="27516"/><M n="29" v="8"/><M n="30" v="27516"/><M n="31" v="7.5713e+08"/><M n="32" v="8"/><M n="33" v="27516"/><M n="34" v="7.5713e+08"/><M n="35" v="8"/><M n="36" v="27516"/><M n="37" v="27516"/>
<C i="7" s="110" l="138">
<M n="16" v="27558"/><M n="17" v="27558"/><M n="18" v="8"/><M n="19" v="27558"/><M n="20" v="7.59443e+08"/><M n="21" v="8"/><M n="22" v="27558"/><M n="23" v="7.59443e+08"/><M n="24" v="8"/><M n="25" v="27558"/><M n="26" v="27558"/><M n="29" v="8"/><M n="32" v="8"/><M n="35" v="8"/><M n="36" v="2.22507e-308"/>
<PF i="8" s="14" l="66" lm="2" f="3" n="14">
<M n="16" v="27558"/><M n="17" v="27558"/><M n="18" v="8"/><M n="19" v="27558"/><M n="20" v="7.59443e+08"/><M n="21" v="8"/><M n="22" v="27558"/><M n="23" v="7.59443e+08"/><M n="24" v="8"/><M n="25" v="27558"/><M n="26" v="27558"/><M n="27" v="27558"/><M n="28" v="27558"/><M n="29" v="8"/><M n="30" v="27558"/><M n="31" v="7.59443e+08"/><M n="32" v="8"/><M n="33" v="27558"/><M n="34" v="7.59443e+08"/><M n="35" v="8"/><M n="36" v="27558"/><M n="37" v="27558"/>
<L i="9" s="22" l="81">
<M n="16" v="6609"/><M n="17" v="6609"/><M n="18" v="8"/><M n="19" v="6609"/><M n="20" v="4.36789e+07"/><M n="21" v="8"/><M n="22" v="6609"/><M n="23" v="4.36789e+07"/><M n="24" v="8"/><M n="25" v="6609"/><M n="26" v="6609"/><M n="27" v="6609"/><M n="28" v="6609"/><M n="29" v="8"/><M n="30" v="6609"/><M n="31" v="4.36789e+07"/><M n="32" v="8"/><M n="33" v="6609"/><M n="34" v="4.36789e+07"/><M n="35" v="8"/><M n="36" v="6609"/><M n="37" v="6609"/>
<S i="10" s="25" l="83">
<M n="16" v="6609"/><M n="17" v="6609"/><M n="18" v="8"/><M n="19" v="6609"/><M n="20" v="4.36789e+07"/><M n="21" v="8"/><M n="22" v="6609"/><M n="23" v="4.36789e+07"/><M n="24" v="8"/><M n="25" v="6609"/><M n="26" v="6609"/><M n="27" v="6609"/><M n="28" v="6609"/><M n="29" v="8"/><M n="30" v="6609"/><M n="31" v="4.36789e+07"/><M n="32" v="8"/><M n="33" v="6609"/><M n="34" v="4.36789e+07"/><M n="35" v="8"/><M n="36" v="6609"/><M n="37" v="6609"/>
</S>
</L>
<S i="11" s="34" l="97">
<M n="16" v="20949"/><M n="17" v="20949"/><M n="18" v="8"/><M n="19" v="20949"/><M n="20" v="4.38861e+08"/><M n="21" v="8"/><M n="22" v="20949"/><M n="23" v="4.38861e+08"/><M n="24" v="8"/><M n="25" v="20949"/><M n="26" v="20949"/><M n="27" v="20949"/><M n="28" v="20949"/><M n="29" v="8"/><M n="30" v="20949"/><M n="31" v="4.38861e+08"/><M n="32" v="8"/><M n="33" v="20949"/><M n="34" v="4.38861e+08"/><M n="35" v="8"/><M n="36" v="20949"/><M n="37" v="20949"/>
</S>
</PF>
</C>
<S i="12" s="110" l="138">
<M n="16" v="27516"/><M n="17" v="27516"/><M n="18" v="8"/><M n="19" v="27516"/><M n="20" v="7.5713e+08"/><M n="21" v="8"/><M n="22" v="27516"/><M n="23" v="7.5713e+08"/><M n="24" v="8"/><M n="25" v="27516"/><M n="26" v="27516"/><M n="27" v="27516"/><M n="28" v="27516"/><M n="29" v="8"/><M n="30" v="27516"/><M n="31" v="7.5713e+08"/><M n="32" v="8"/><M n="33" v="27516"/><M n="34" v="7.5713e+08"/><M n="35" v="8"/><M n="36" v="27516"/><M n="37" v="27516"/>
</S>
</L>
</L>
</PF>
</C>
<C i="13" s="173" l="230">
<M n="16" v="8.54932e+07"/><M n="17" v="8.54932e+07"/><M n="18" v="8"/><M n="19" v="8.54932e+07"/><M n="20" v="9.14883e+14"/><M n="21" v="8"/><M n="22" v="8.54932e+07"/><M n="23" v="9.14883e+14"/><M n="24" v="8"/><M n="25" v="9.64224e+06"/><M n="26" v="1.08493e+07"/><M n="29" v="8"/><M n="32" v="8"/><M n="35" v="8"/><M n="36" v="2.22507e-308"/>
<PF i="14" s="78" l="103" lm="2" f="36" n="78">
<M n="16" v="8.54932e+07"/><M n="17" v="8.54932e+07"/><M n="18" v="8"/><M n="19" v="8.54932e+07"/><M n="20" v="9.14883e+14"/><M n="21" v="8"/><M n="22" v="8.54932e+07"/><M n="23" v="9.14883e+14"/><M n="24" v="8"/><M n="25" v="9.64224e+06"/><M n="26" v="1.08493e+07"/><M n="29" v="8"/><M n="32" v="8"/><M n="35" v="8"/><M n="36" v="2.22507e-308"/>
<C i="15" s="81" l="105">
<M n="16" v="13874"/><M n="17" v="13874"/><M n="18" v="8"/><M n="19" v="13874"/><M n="20" v="1.92488e+08"/><M n="21" v="8"/><M n="22" v="13874"/><M n="23" v="1.92488e+08"/><M n="24" v="8"/><M n="25" v="13874"/><M n="26" v="13874"/><M n="29" v="8"/><M n="32" v="8"/><M n="35" v="8"/><M n="36" v="2.22507e-308"/>
<PF i="16" s="64" l="76" lm="2" f="36" n="64">
<M n="16" v="13874"/><M n="17" v="13874"/><M n="18" v="8"/><M n="19" v="13874"/><M n="20" v="1.92488e+08"/><M n="21" v="8"/><M n="22" v="13874"/><M n="23" v="1.92488e+08"/><M n="24" v="8"/><M n="25" v="13874"/><M n="26" v="13874"/><M n="27" v="13874"/><M n="28" v="13874"/><M n="29" v="8"/><M n="30" v="13874"/><M n="31" v="1.92488e+08"/><M n="32" v="8"/><M n="33" v="13874"/><M n="34" v="1.92488e+08"/><M n="35" v="8"/><M n="36" v="13874"/><M n="37" v="13874"/>
<L i="17" s="66" l="77">
<M n="16" v="13874"/><M n="17" v="13874"/><M n="18" v="8"/><M n="19" v="13874"/><M n="20" v="1.92488e+08"/><M n="21" v="8"/><M n="22" v="13874"/><M n="23" v="1.92488e+08"/><M n="24" v="8"/><M n="25" v="13874"/><M n="26" v="13874"/><M n="27" v="13874"/><M n="28" v="13874"/><M n="29" v="8"/><M n="30" v="13874"/><M n="31" v="1.92488e+08"/><M n="32" v="8"/><M n="33" v="13874"/><M n="34" v="1.92488e+08"/><M n="35" v="8"/><M n="36" v="13874"/><M n="37" v="13874"/>
<S i="18" s="68" l="78">
<M n="16" v="13874"/><M n="17" v="13874"/><M n="18" v="8"/><M n="19" v="13874"/><M n="20" v="1.92488e+08"/><M n="21" v="8"/><M n="22" v="13874"/><M n="23" v="1.92488e+08"/><M n="24" v="8"/><M n="25" v="13874"/><M n="26" v="13874"/><M n="27" v="13874"/><M n="28" v="13874"/><M n="29" v="8"/><M n="30" v="13874"/><M n="31" v="1.92488e+08"/><M n="32" v="8"/><M n="33" v="13874"/><M n="34" v="1.92488e+08"/><M n="35" v="8"/><M n="36" v="13874"/><M n="37" v="13874"/>
</S>
</L>
</PF>
</C>
<L i="19" s="88" l="112">
<M n="16" v="8.54793e+07"/><M n="17" v="8.54793e+07"/><M n="18" v="8"/><M n="19" v="8.54793e+07"/><M n="20" v="9.14616e+14"/><M n="21" v="8"/><M n="22" v="8.54793e+07"/><M n="23" v="9.14616e+14"/><M n="24" v="8"/><M n="25" v="9.62837e+06"/><M n="26" v="1.08493e+07"/><M n="29" v="8"/><M n="32" v="8"/><M n="35" v="8"/><M n="36" v="2.22507e-308"/>
<C i="20" s="91" l="113">
<M n="16" v="8.54793e+07"/><M n="17" v="8.54793e+07"/><M n="18" v="8"/><M n="19" v="8.54793e+07"/><M n="20" v="9.14616e+14"/><M n="21" v="8"/><M n="22" v="8.54793e+07"/><M n="23" v="9.14616e+14"/><M n="24" v="8"/><M n="25" v="9.62837e+06"/><M n="26" v="1.08493e+07"/><M n="29" v="8"/><M n="32" v="8"/><M n="35" v="8"/><M n="36" v="2.22507e-308"/>
<PF i="21" s="55" l="42" lm="2" f="36" n="55">
<M n="16" v="8.54793e+07"/><M n="17" v="8.54793e+07"/><M n="18" v="8"/><M n="19" v="8.54793e+07"/><M n="20" v="9.14616e+14"/><M n="21" v="8"/><M n="22" v="8.54793e+07"/><M n="23" v="9.14616e+14"/><M n="24" v="8"/><M n="25" v="9.62837e+06"/><M n="26" v="1.08493e+07"/><M n="29" v="8"/><M n="32" v="8"/><M n="35" v="8"/><M n="36" v="2.22507e-308"/>
<C i="22" s="57" l="42">
<M n="16" v="7.58639e+07"/><M n="17" v="7.58639e+07"/><M n="18" v="8"/><M n="19" v="7.58639e+07"/><M n="20" v="8.21911e+14"/><M n="21" v="8"/><M n="22" v="7.58639e+07"/><M n="23" v="8.21911e+14"/><M n="24" v="8"/><M n="25" v="12905"/><M n="26" v="1.08493e+07"/><M n="29" v="8"/><M n="32" v="8"/><M n="35" v="8"/><M n="36" v="2.22507e-308"/>
<PF i="23" s="243" l="0" lm="241" f="242" n="243">
<M n="16" v="7.58639e+07"/><M n="17" v="7.58639e+07"/><M n="18" v="8"/><M n="19" v="7.58639e+07"/><M n="20" v="8.21911e+14"/><M n="21" v="8"/><M n="22" v="7.58639e+07"/><M n="23" v="8.21911e+14"/><M n="24" v="8"/><M n="25" v="12905"/><M n="26" v="1.08493e+07"/><M n="29" v="8"/><M n="32" v="8"/><M n="35" v="8"/><M n="36" v="2.22507e-308"/>
<C i="24" s="244" l="0">
<M n="16" v="7.5851e+07"/><M n="17" v="7.5851e+07"/><M n="18" v="8"/><M n="19" v="7.5851e+07"/><M n="20" v="8.2191e+14"/><M n="21" v="8"/><M n="22" v="7.5851e+07"/><M n="23" v="8.2191e+14"/><M n="24" v="8"/><M n="25" v="1.0822e+07"/><M n="26" v="1.08493e+07"/><M n="29" v="8"/><M n="32" v="8"/><M n="35" v="8"/><M n="36" v="2.22507e-308"/>
<PF i="25" s="239" l="923" lm="237" f="238" n="239">
<M n="16" v="7.5851e+07"/><M n="17" v="7.5851e+07"/><M n="18" v="8"/><M n="19" v="7.5851e+07"/><M n="20" v="8.2191e+14"/><M n="21" v="8"/><M n="22" v="7.5851e+07"/><M n="23" v="8.2191e+14"/><M n="24" v="8"/><M n="25" v="1.0822e+07"/><M n="26" v="1.08493e+07"/><M n="29" v="8"/><M n="32" v="8"/><M n="35" v="8"/><M n="36" v="2.22507e-308"/>
<C i="26" s="240" l="923">
<M n="16" v="7.5851e+07"/><M n="17" v="7.5851e+07"/><M n="18" v="8"/><M n="19" v="7.5851e+07"/><M n="20" v="8.2191e+14"/><M n="21" v="8"/><M n="22" v="7.5851e+07"/><M n="23" v="8.2191e+14"/><M n="24" v="8"/><M n="25" v="1.0822e+07"/><M n="26" v="1.08493e+07"/><M n="29" v="8"/><M n="32" v="8"/><M n="35" v="8"/><M n="36" v="2.22507e-308"/>
<PF i="27" s="243" l="0" lm="241" f="242" n="243">
<M n="16" v="7.5851e+07"/><M n="17" v="7.5851e+07"/><M n="18" v="8"/><M n="19" v="7.5851e+07"/><M n="20" v="8.2191e+14"/><M n="21" v="8"/><M n="22" v="7.5851e+07"/><M n="23" v="8.2191e+14"/><M n="24" v="8"/><M n="25" v="1.0822e+07"/><M n="26" v="1.08493e+07"/><M n="29" v="8"/><M n="32" v="8"/><M n="35" v="8"/><M n="36" v="2.22507e-308"/>
<C i="28" s="244" l="0">
<M n="16" v="6952"/><M n="17" v="6952"/><M n="18" v="8"/><M n="19" v="6952"/><M n="20" v="3.15456e+07"/><M n="21" v="8"/><M n="22" v="6952"/><M n="23" v="3.15456e+07"/><M n="24" v="8"/><M n="25" v="1555"/><M n="26" v="5397"/><M n="29" v="8"/><M n="32" v="8"/><M n="35" v="8"/><M n="36" v="2.22507e-308"/>
<PF i="29" s="243" l="0" lm="241" f="242" n="243">
<M n="16" v="6952"/><M n="17" v="6952"/><M n="18" v="8"/><M n="19" v="6952"/><M n="20" v="3.15456e+07"/><M n="21" v="8"/><M n="22" v="6952"/><M n="23" v="3.15456e+07"/><M n="24" v="8"/><M n="25" v="1555"/><M n="26" v="5397"/><M n="27" v="6952"/><M n="28" v="6952"/><M n="29" v="8"/><M n="30" v="6952"/><M n="31" v="3.15456e+07"/><M n="32" v="8"/><M n="33" v="6952"/><M n="34" v="3.15456e+07"/><M n="35" v="8"/><M n="36" v="1555"/><M n="37" v="5397"/>
<S i="30" s="244" l="0">
<M n="16" v="6952"/><M n="17" v="6952"/><M n="18" v="8"/><M n="19" v="6952"/><M n="20" v="3.15456e+07"/><M n="21" v="8"/><M n="22" v="6952"/><M n="23" v="3.15456e+07"/><M n="24" v="8"/><M n="25" v="1555"/><M n="26" v="5397"/><M n="27" v="6952"/><M n="28" v="6952"/><M n="29" v="8"/><M n="30" v="6952"/><M n="31" v="3.15456e+07"/><M n="32" v="8"/><M n="33" v="6952"/><M n="34" v="3.15456e+07"/><M n="35" v="8"/><M n="36" v="1555"/><M n="37" v="5397"/>
</S>
</PF>
</C>
<C i="31" s="244" l="0">
<M n="16" v="7.16722e+07"/><M n="17" v="7.16722e+07"/><M n="18" v="8"/><M n="19" v="7.16722e+07"/><M n="20" v="7.36613e+14"/><M n="21" v="8"/><M n="22" v="7.16722e+07"/><M n="23" v="7.36613e+14"/><M n="24" v="8"/><M n="25" v="9.47008e+06"/><M n="26" v="1.08015e+07"/><M n="29" v="8"/><M n="32" v="8"/><M n="35" v="8"/><M n="36" v="2.22507e-308"/>
<PF i="32" s="37" l="42" lm="2" f="36" n="37">
<M n="16" v="7.16722e+07"/><M n="17" v="7.16722e+07"/><M n="18" v="8"/><M n="19" v="7.16722e+07"/><M n="20" v="7.36613e+14"/><M n="21" v="8"/><M n="22" v="7.16722e+07"/><M n="23" v="7.36613e+14"/><M n="24" v="8"/><M n="25" v="9.47008e+06"/><M n="26" v="1.08015e+07"/><M n="27" v="7.16722e+07"/><M n="28" v="7.16722e+07"/><M n="29" v="8"/><M n="30" v="7.16722e+07"/><M n="31" v="7.36613e+14"/><M n="32" v="8"/><M n="33" v="7.16722e+07"/><M n="34" v="7.36613e+14"/><M n="35" v="8"/><M n="36" v="9.47008e+06"/><M n="37" v="1.08015e+07"/>
<L i="33" s="40" l="42">
<M n="16" v="7.16722e+07"/><M n="17" v="7.16722e+07"/><M n="18" v="8"/><M n="19" v="7.16722e+07"/><M n="20" v="7.36613e+14"/><M n="21" v="8"/><M n="22" v="7.16722e+07"/><M n="23" v="7.36613e+14"/><M n="24" v="8"/><M n="25" v="9.47008e+06"/><M n="26" v="1.08015e+07"/><M n="29" v="8"/><M n="32" v="8"/><M n="35" v="8"/><M n="36" v="2.22507e-308"/>
<L i="34" s="42" l="46">
<M n="16" v="7.16722e+07"/><M n="17" v="7.16722e+07"/><M n="18" v="8"/><M n="19" v="7.16722e+07"/><M n="20" v="7.36613e+14"/><M n="21" v="8"/><M n="22" v="7.16722e+07"/><M n="23" v="7.36613e+14"/><M n="24" v="8"/><M n="25" v="9.47008e+06"/><M n="26" v="1.08015e+07"/><M n="27" v="184923"/><M n="28" v="184923"/><M n="29" v="8"/><M n="30" v="184923"/><M n="31" v="2.10296e+10"/><M n="32" v="8"/><M n="33" v="184923"/><M n="34" v="2.10296e+10"/><M n="35" v="8"/><M n="36" v="2985"/><M n="37" v="142993"/>
<S i="35" s="43" l="46">
<M n="16" v="153975"/><M n="17" v="153975"/><M n="18" v="8"/><M n="19" v="153975"/><M n="20" v="1.91308e+10"/><M n="21" v="8"/><M n="22" v="153975"/><M n="23" v="1.91308e+10"/><M n="24" v="8"/><M n="25" v="1997"/><M n="26" v="138004"/><M n="27" v="153975"/><M n="28" v="153975"/><M n="29" v="8"/><M n="30" v="153975"/><M n="31" v="1.91308e+10"/><M n="32" v="8"/><M n="33" v="153975"/><M n="34" v="1.91308e+10"/><M n="35" v="8"/><M n="36" v="1997"/><M n="37" v="138004"/>
</S>
<S i="36" s="44" l="47">